{"schema_version":"formalization-faithfulness-1","role":"adjudicator","task_id":"HDP-01-EXERCISE-1.2.6","trigger":["blind translator left dependency_coverage item D052 unclear"],"resolved_items":[{"item":"D052","resolution":"Resolved: it is the Bochner integral against the explicitly supplied measure μ; integrability selects the genuine L1 branch.","primary_evidence":"Mathlib defines integral μ f; local expectation is ∫X∂μ and variance is the same-μ integral of the squared centered function."}],"implications":{"lean_implies_source":{"verdict":"yes","reasoning":"Specializing μ to the source probability measure yields the exact squared-event, Markov, variance, and Chebyshev derivation."},"source_implies_lean":{"verdict":"no","reasoning":"The source covers probability measures only; Lean nonvacuously quantifies over arbitrary measures."}},"classification":"faithful-stronger","accepted":true,"remaining_uncertainties":[],"findings":[{"severity":"note","category":"arbitrary-measure-generalization","evidence":"Lean uses unnormalized μ-integrals for arbitrary measures; the source uses probability, mean, and variance.","impact":"A genuine strengthening that specializes exactly to the source."},{"severity":"note","category":"finite-real-measure-semantics","evidence":"Although μ.real maps infinite values to zero, the Markov producer proves the relevant event measure finite before conversion.","impact":"The bound is not a toReal-of-infinity artifact."}],"rationale":"D052 has the required μ-integral semantics; the target exactly recovers the source and adds valid arbitrary-measure cases."}
