{
  "schema_version": "formalization-faithfulness-1",
  "role": "adjudicator",
  "task_id": "HDP-01-DEF-MOMENTS-OBSTRUCTION",
  "trigger": [
    "judge classifications differ"
  ],
  "resolved_items": [
    {
      "item": "judge classifications differ",
      "resolution": "Resolve the direct judge's faithful-equivalent classification and the round-trip judge's faithful-stronger classification in favor of faithful-stronger. In the designated DISCREPANCY-row role, the Lean proposition is a valid and nonvacuous witness to the unrestricted signed-real half-power obstruction: fixing the source-allowed order p = 1/2, any ordinary pointwise real half-power satisfying the square law on every possible real value of X would be a function forbidden by the Lean theorem. However, the source passage itself states the ordinary- and absolute-moment definitions and leaves signed noninteger exponentiation underdetermined; it does not state the square-law axiom or the exact no-global-right-inverse theorem. The Lean artifact therefore adds genuine algebraic specificity rather than merely reformulating an explicit source assertion.",
      "primary_evidence": "PDF page 1 (printed page 5), Section 1.1 says, for every p > 0, that the p-th moment is E(X^p) and the p-th absolute moment is E(|X|^p); footnote 1 makes X real-valued and no nonnegativity restriction is stated. The source contract records the resulting negative-base/noninteger-exponent ambiguity and does not extract any explicit square-root law. The direct and blind dossiers elaborate the Lean proposition as Not (Exists sqrtLike : Real -> Real, forall x : Real, (sqrtLike x)^2 = x), with ^2 resolved to ordinary natural squaring in Real. Thus negative inputs, for example x = -1, make the Lean claim substantive, while expectation, the two moment definitions, and integrability are absent from the target."
    }
  ],
  "implications": {
    "lean_implies_source": {
      "verdict": "yes",
      "reasoning": "Read strictly in its configured DISCREPANCY-row role, the Lean theorem establishes a concrete obstruction to the source's unrestricted signed-real expression X^p. The source allows p = 1/2 and does not exclude negative values of X. If ordinary real half-power were total on those pointwise values and satisfied the defining square law, x mapped to x^(1/2) would be a function Real -> Real whose square equals x for every real x, exactly what Lean rules out. Because the failure is pointwise, it arises before expectation and is witnessed by a constant negative random variable. This implication supports the obstruction only; it does not say that Lean encodes the printed moment definitions."
    },
    "source_implies_lean": {
      "verdict": "no",
      "reasoning": "The cited source passage supplies the notations E(X^p) and E(|X|^p) for p > 0 and thereby exposes an underdetermined negative-base/noninteger-exponent case, but it neither imposes the equation (x^(1/2))^2 = x nor asserts that no total right inverse to real squaring exists. Moving from that underdetermination to the exact closed nonexistence theorem adds a specific, nonvacuous algebraic claim. The source therefore does not imply the Lean proposition at the statement-faithfulness level used by this audit."
    }
  },
  "classification": "faithful-stronger",
  "accepted": true,
  "remaining_uncertainties": [],
  "findings": [
    {
      "severity": "note",
      "category": "discrepancy-witness-scope",
      "evidence": "The source defines E(X^p) and E(|X|^p), while the Lean target states only nonexistence of a total sqrtLike : Real -> Real satisfying (sqrtLike x)^2 = x for all x.",
      "impact": "The artifact is accepted as the designated counterexample witness for unrestricted real half-power semantics. It must not be described as a Lean statement of either moment definition, and it does not address the source's separate expectation/integrability ambiguity."
    },
    {
      "severity": "minor",
      "category": "added-algebraic-specificity",
      "evidence": "The source passage does not state a square-root right-inverse law or its nonexistence; the Lean target asserts that exact closed theorem over all real inputs.",
      "impact": "The extra exact assertion is genuine nonvacuous strength, so faithful-stronger is the consistent accepted classification rather than faithful-equivalent."
    },
    {
      "severity": "note",
      "category": "counterexample-specialization",
      "evidence": "The source quantifies over all p > 0, including p = 1/2, and the Lean target retains all real inputs, including the negative values that cause failure.",
      "impact": "Fixing p = 1/2 is sufficient for a counterexample to the unrestricted scope and does not restrict away the problematic domain; it is not reduced applicability in this discrepancy-witness role."
    }
  ],
  "rationale": "The Lean proposition faithfully witnesses one decisive defect in the unrestricted ordinary-moment notation: a standard real half-power cannot be assigned to every real pointwise value while obeying the square law. Its domains, quantifiers, equality, exponent 2, and Real power instance all match that counterexample, and the claim is nonvacuous because negative real inputs exist. The artifact is nevertheless not equivalent to the printed source statement: the source prints two moment definitions and leaves the signed noninteger-power convention open, whereas Lean adds the exact no-global-square-root theorem and omits expectation, the absolute-moment definition, and integrability. Therefore Lean implies the intended obstruction, the source statement does not imply this exact Lean assertion, and the consistent classification is faithful-stronger and accepted for the DISCREPANCY row only."
}
