{
  "schema_version": "formalization-faithfulness-1",
  "role": "adjudicator",
  "task_id": "HDP-02-THM-2.6.2",
  "trigger": [
    "direct judge requested adjudication",
    "round-trip judge requested adjudication",
    "direct judge classification is undetermined",
    "round-trip judge classification is undetermined",
    "direct judge left dependency_coverage item D001 unclear",
    "direct judge left dependency_coverage item D045 unclear",
    "direct judge left semantic_checklist item C07 unclear",
    "direct judge left semantic_checklist item C11 unclear",
    "round-trip judge left semantic_checklist item C11 unclear",
    "direct judge left implication lean_implies_source unclear",
    "round-trip judge left implication translation_implies_source unclear"
  ],
  "resolved_items": [
    {
      "item": "direct judge requested adjudication",
      "resolution": "Adjudication resolves the zero-denominator question in favor of proposition-level equivalence.",
      "primary_evidence": "Pinned Theorem 2.6.2 covers every t >= 0 without a nondegeneracy hypothesis; D001 and D003-D008 supply the complete Lean proposition and intrinsic psi-two gauge."
    },
    {
      "item": "round-trip judge requested adjudication",
      "resolution": "The blind translation and source have the same mathematical content after the conventional degenerate-scale reading is made explicit.",
      "primary_evidence": "The blind translation records total real division and an optional empty index type, while the pinned theorem and source contract record the usual finite-family Hoeffding bound."
    },
    {
      "item": "direct judge classification is undetermined",
      "resolution": "Resolved as faithful-equivalent because both implication directions hold.",
      "primary_evidence": "D001 agrees with the pinned theorem for positive total psi-two energy; zero-energy and empty-family cases are automatic consequences of the hypotheses."
    },
    {
      "item": "round-trip judge classification is undetermined",
      "resolution": "Resolved as faithful-equivalent because the translated proposition neither loses nor adds a nontrivial case.",
      "primary_evidence": "The blind translation preserves the universal constant, hypotheses, event, scale, and tail bound; its additional empty-family case is identically true."
    },
    {
      "item": "direct judge left dependency_coverage item D001 unclear",
      "resolution": "D001 matches the source proposition, including its conventional treatment of the degenerate scale.",
      "primary_evidence": "D001 places one positive c before all finite families and asserts the same two-sided bound as Theorem 2.6.2. Under D003-D008, zero total squared gauge forces every summand to vanish almost surely."
    },
    {
      "item": "direct judge left dependency_coverage item D045 unclear",
      "resolution": "D045's total division changes the displayed numerical right-hand side at zero denominator but does not change the truth conditions of the complete theorem.",
      "primary_evidence": "D045 gives Lean real division, so a zero denominator produces right-hand side 2. The source's intrinsic norm convention makes zero total energy imply an almost-surely zero sum, yielding probability 0 for t > 0 and the trivial bound at t = 0."
    },
    {
      "item": "direct judge left semantic_checklist item C07 unclear",
      "resolution": "C07 passes: the inequality direction, strictness, tail sidedness, and effective conclusion strength match.",
      "primary_evidence": "The pinned display and D001 both use a non-strict upper bound for the event that the absolute sum is at least t. The zero-energy arithmetic difference is redundant under the shared hypotheses."
    },
    {
      "item": "direct judge left semantic_checklist item C11 unclear",
      "resolution": "C11 passes with a documented harmless boundary convention.",
      "primary_evidence": "The pinned theorem has no positive-energy assumption. Conventionally, zero psi-two norm means equality to zero almost surely; D003-D008 give the same consequence for the Lean gauge under the supplied sub-gaussian witness."
    },
    {
      "item": "round-trip judge left semantic_checklist item C11 unclear",
      "resolution": "C11 passes: totalized division supplies a weaker-looking but automatically true bound exactly where the conventional source conclusion follows independently from degeneracy.",
      "primary_evidence": "The blind translation explicitly records that division by zero makes the right-hand side 2, while the source contract records the denominator as a sum of squared intrinsic psi-two norms."
    },
    {
      "item": "direct judge left implication lean_implies_source unclear",
      "resolution": "lean_implies_source is yes.",
      "primary_evidence": "For positive total energy D001 is the pinned bound after finite reindexing. At zero energy, D003-D008 imply all variables and their sum vanish almost surely, which supplies the conventional source boundary conclusion despite Lean's totalized right-hand side."
    },
    {
      "item": "round-trip judge left implication translation_implies_source unclear",
      "resolution": "translation_implies_source is yes.",
      "primary_evidence": "The blind translation is exact at positive energy; at zero energy its hypotheses force the source's degenerate conclusion, and restricting an arbitrary finite type to the source's conventionally nonempty families removes the harmless empty case."
    }
  ],
  "implications": {
    "lean_implies_source": {
      "verdict": "yes",
      "reasoning": "For every nonempty family with positive total squared psi-two energy, the formulas coincide after finite reindexing. If the energy is zero, finiteness of each gauge follows from the sub-gaussian witness, and a zero intrinsic psi-two gauge forces the corresponding variable to vanish almost surely. Hence the sum vanishes almost surely: for t > 0 the conventional source boundary bound has probability zero, and at t = 0 the estimate is trivial. Lean's total division therefore does not obstruct this implication."
    },
    "source_implies_lean": {
      "verdict": "yes",
      "reasoning": "For positive total energy, the source gives exactly D001's inequality. At zero energy Lean's total division makes the right-hand side 2, so the conclusion follows from the probability bound by 1. The extra empty-Fintype case is also automatic: the sum and denominator are zero, with probability 1 at t = 0 and probability 0 for t > 0. Thus the same universal source constant witnesses the Lean proposition."
    }
  },
  "classification": "faithful-equivalent",
  "accepted": true,
  "remaining_uncertainties": [],
  "findings": [
    {
      "severity": "note",
      "category": "zero-denominator-totalization",
      "evidence": "The pinned theorem has no nondegeneracy hypothesis, while D001 and D045 use total real division, giving right-hand side 2 when the total squared gauge is zero.",
      "impact": "The displayed right-hand sides differ at zero energy for positive t, but the shared hypotheses force an almost-surely zero sum, so neither implication nor the classification changes."
    },
    {
      "severity": "note",
      "category": "empty-index-extension",
      "evidence": "The source conventionally writes a nonempty family X_1,...,X_N, whereas D001 quantifies over every Fintype, including the empty type.",
      "impact": "The added empty case is automatic for every positive c and every t >= 0, so it is not genuine additional strength or reduced applicability."
    }
  ],
  "rationale": "The contract preserves the absolute universal constant, independent centered sub-gaussian hypotheses, intrinsic psi-two scale, two-sided event, prefactor, exponent, and threshold range. The only apparent discrepancy is Lean's total division at zero total energy. Under the source's conventional mathematical reading and the supplied intrinsic-gauge definitions, zero energy forces the sum to vanish almost surely, making the sharper source boundary conclusion automatic; conversely, Lean's totalized bound is automatic there. The empty-Fintype extension is likewise automatic. Both implications therefore hold, the theorem is nonvacuous on positive-energy families, and the correct classification is faithful-equivalent."
}
