{
  "schema_version":"formalization-faithfulness-1","role":"adjudicator","task_id":"HDP-01-LEM-1.2.1",
  "trigger":["direct judge requested adjudication","round-trip judge requested adjudication","direct judge classification is undetermined","round-trip judge classification is undetermined","direct judge left dependency_coverage item D008 unclear","direct judge left semantic_checklist item C04 unclear","direct judge left semantic_checklist item C10 unclear","round-trip judge left semantic_checklist item C04 unclear","round-trip judge left semantic_checklist item C10 unclear","direct judge left implication lean_implies_source unclear","round-trip judge left implication translation_implies_source unclear"],
  "resolved_items":[
    {"item":"direct judge requested adjudication","resolution":"Both implication directions are yes; classification is faithful-equivalent and accepted.","primary_evidence":"PDF page 3 states the extended layer-cake identity without integrability and says both sides are finite or infinite simultaneously; the target states the unconditional ENNReal equality and guarded real specialization."},
    {"item":"round-trip judge requested adjudication","resolution":"The blind translation reconstructs the target and comparison with primary source yields equivalence.","primary_evidence":"The blind artifacts identify pointwise nonnegativity, unconditional ENNReal equality, strict t<X event, Ioi 0, and conditional real equality; PDF page 3 supplies the same layer-cake content."},
    {"item":"direct judge classification is undetermined","resolution":"Resolved faithful-equivalent: any pointwise-versus-a.s. representative difference is semantically removable for this claim.","primary_evidence":"The source defines expectation as Lebesgue integration; the target conclusions are integrals and tail-event measures invariant under null modification."},
    {"item":"round-trip judge classification is undetermined","resolution":"Resolved faithful-equivalent using Y=max(X,0): for a.s.-nonnegative X, Y is pointwise nonnegative and equal a.e.; for t>0 the strict tails coincide and ofReal values agree.","primary_evidence":"The blind translation matches the target, while the source claim contains only expectation and positive-threshold tail content."},
    {"item":"direct judge left dependency_coverage item D008 unclear","resolution":"D008 is ordinary pointwise real nonnegativity; the unlabeled source convention causes no genuine applicability difference after null-set modification.","primary_evidence":"The elaborated target applies Real.instLE in ∀ω,0≤Xω; PDF page 3 substitutes X into the scalar nonnegative identity."},
    {"item":"direct judge left semantic_checklist item C04 unclear","resolution":"C04 passes semantically: if source nonnegativity is a.s., replacing X by max(X,0) preserves expectation and positive tails.","primary_evidence":"The target explicitly uses pointwise nonnegativity; the source conclusions use only Lebesgue expectation and P{X>t}."},
    {"item":"direct judge left semantic_checklist item C10 unclear","resolution":"C10 passes because max(X,0) removes the representative difference without changing asserted quantities.","primary_evidence":"The target uses ofReal, positive-threshold events, and Lebesgue integration, all invariant under the stated replacement."},
    {"item":"round-trip judge left semantic_checklist item C04 unclear","resolution":"C04 passes for the reconstructed proposition for the same null-set-invariance reason.","primary_evidence":"The blind translation records pointwise nonnegativity; the source law/integral content is a.e.-invariant."},
    {"item":"round-trip judge left semantic_checklist item C10 unclear","resolution":"C10 passes: the pointwise premise creates no genuine domain restriction after max(X,0).","primary_evidence":"For t>0, max(X,0)>t iff X>t; ofReal(max(X,0))=ofReal X; integrals agree for a.s.-equal functions."},
    {"item":"direct judge left implication lean_implies_source unclear","resolution":"Yes. Under pointwise source reading it is immediate; under an a.s. reading apply Lean to max(X,0) and transfer by a.e. equality and positive-tail equality.","primary_evidence":"The target is universal in measurable X; source expectation is a Lebesgue integral and the right side uses strict positive-threshold events."},
    {"item":"round-trip judge left implication translation_implies_source unclear","resolution":"Yes. The same max(X,0) transfer proves the source under either representative convention.","primary_evidence":"Blind artifacts expose the same pointwise premise and integral/tail conclusions; PDF page 3 gives the source identity and finiteness assertion."}
  ],
  "implications":{
    "lean_implies_source":{"verdict":"yes","reasoning":"Under a pointwise reading the ENNReal equality is exactly the source. Under an a.s. reading, Y=max(X,0) is pointwise nonnegative, agrees with X a.e., has the same ofReal integrand and the same strict positive-threshold events; applying Lean to Y transfers to X."},
    "source_implies_lean":{"verdict":"yes","reasoning":"Every pointwise-nonnegative X is source-admissible under either convention. The source extended identity gives the first conjunct; in the integrable finite case conversion to real values gives the redundant guarded real equality."}
  },
  "classification":"faithful-equivalent","accepted":true,
  "remaining_uncertainties":["The source never explicitly says whether ‘non-negative random variable’ is pointwise or almost surely nonnegative. This documentary ambiguity does not leave either implication uncertain because max(X,0) preserves the expectation and positive-tail content."],
  "findings":[
    {"severity":"note","category":"nonnegativity-representative-convention","evidence":"PDF page 3 uses unqualified nonnegativity and a scalar proof; Lean explicitly requires ∀ω,0≤Xω.","impact":"The wording convention is unresolvable but semantically harmless after replacement by max(X,0)."},
    {"severity":"note","category":"extended-value-semantics","evidence":"The source says both sides are finite or infinite simultaneously; the target equates ENNReal lintegrals.","impact":"The finite and jointly infinite cases are both represented."},
    {"severity":"note","category":"redundant-real-specialization","evidence":"The target adds an ordinary real equality only under Integrable X.","impact":"It follows from the finite extended equality and adds no strength."},
    {"severity":"note","category":"integration-endpoint","evidence":"Source writes 0 to infinity; Lean uses Ioi 0.","impact":"They differ only by the Lebesgue-null singleton {0}."}
  ],
  "rationale":"The target preserves the probability setting, strict upper-tail event, positive-threshold Lebesgue integral, and possible infinity. ENNReal equality captures simultaneous finiteness, the real conjunct is redundant, and Ioi 0 is endpoint-equivalent. The source's pointwise/a.s. ambiguity is removed semantically by X↦max(X,0), so both implications hold and the result is faithful-equivalent."
}
