{
  "schema_version": "formalization-faithfulness-1",
  "role": "adjudicator",
  "task_id": "LEV-CH01-ADVECTION-WAVE-IDENTITY",
  "trigger": [
    "judge classifications differ"
  ],
  "resolved_items": [
    {
      "item": "judge classifications differ",
      "resolution": "The direct judge's two-way implication result is sustained. The round-trip objection treats use of one arbitrary field and one arbitrary matched coefficient as a collapse of distinct source objects, but this is exactly the extensional encoding of the source's alpha-renaming q <-> w and u-bar <-> c: for every common argument, the two equation predicates agree. The source's physical descriptions and its suggestion about reusable techniques explain why the identity matters; they are not additional mathematical conjuncts of the selected identity claim.",
      "primary_evidence": "Raw PDF page 24 states that (1.2), q_t + u-bar*q_x = 0, and (1.4), w_t + c*w_x = 0, are mathematically identical. In the direct dossier, D001 and D002 both unfold, on their supplied field, coefficient, x, and t, to D003; D003 is existence of the two point derivatives with residual q_t + speed*q_x = 0. The target universally quantifies the shared arguments and asserts Iff. Equation (1.4) is introduced in the same source passage with c > 0, matching the target's selected right-going regime."
    }
  ],
  "implications": {
    "lean_implies_source": {
      "verdict": "yes",
      "reasoning": "Unfolding the two wrappers yields the same scalar constant-coefficient pointwise PDE predicate with the same signs, derivative variables, coefficient, and zero residual. Universal agreement on a shared arbitrary field and coefficient establishes identity of the two equation schemas under the source's stated renaming; it does not identify the fields' physical meanings."
    },
    "source_implies_lean": {
      "verdict": "yes",
      "reasoning": "The source explicitly identifies (1.2) and (1.4) after q <-> w and u-bar <-> c. Instantiating that schema correspondence by an arbitrary scalar field, the positive coefficient of the selected right-going case, and arbitrary x,t gives exactly the target Iff between the two pointwise predicates."
    }
  },
  "classification": "faithful-equivalent",
  "accepted": true,
  "remaining_uncertainties": [],
  "findings": [
    {
      "severity": "note",
      "category": "canonical-renaming-encoding",
      "evidence": "The source compares differently named fields and coefficients only after the correspondence q <-> w and u-bar <-> c; the target universally supplies one arbitrary field and coefficient to both separately declared equation wrappers.",
      "impact": "This is the canonical extensional statement that the equation schemas are identical, not a conflation of concentration with the acoustic variable."
    },
    {
      "severity": "note",
      "category": "right-going-coefficient-regime",
      "evidence": "Equation (1.4) is introduced for c > 0, and the target assumes speed > 0 before comparing it with (1.2).",
      "impact": "The target covers the source-selected right-going correspondence. The assumption is unnecessary for definitional equality but does not remove a case claimed for the cited equation-(1.4) regime."
    }
  ],
  "rationale": "The selected mathematical assertion is equality of two scalar PDE forms under renaming. D001 and D002 have identical semantic bodies through D003, and the target states their pointwise equivalence for arbitrary arguments in the source's positive-speed wave regime. The round-trip rejection rests on treating explanatory physical context and a methodological suggestion as extra formal conclusions and on misreading shared arbitrary binders as object conflation. Neither defeats the exact equation-form equivalence."
}
