{
  "schema_version": "formalization-faithfulness-1",
  "role": "adjudicator",
  "task_id": "HDP-02-THM-2.8.2",
  "trigger": [
    "direct judge requested adjudication",
    "round-trip judge requested adjudication",
    "direct judge classification is undetermined",
    "round-trip judge classification is undetermined",
    "direct judge left dependency_coverage item D050 unclear",
    "direct judge left semantic_checklist item C06 unclear",
    "direct judge left semantic_checklist item C11 unclear",
    "round-trip judge left semantic_checklist item C06 unclear",
    "round-trip judge left semantic_checklist item C11 unclear",
    "direct judge left implication lean_implies_source unclear",
    "direct judge left implication source_implies_lean unclear",
    "round-trip judge left implication translation_implies_source unclear",
    "round-trip judge left implication source_implies_translation unclear"
  ],
  "resolved_items": [
    {
      "item": "direct judge requested adjudication",
      "resolution": "Adjudication is warranted because the target assigns definite values to explicitly reachable zero-denominator cases for which the printed source supplies no convention.",
      "primary_evidence": "PDF page 26/printed page 37 permits arbitrary a and every t ≥ 0, defines K without requiring K > 0, and displays ordinary real quotients."
    },
    {
      "item": "round-trip judge requested adjudication",
      "resolution": "Adjudication is warranted for the same source-silent boundary semantics identified by the blind translation.",
      "primary_evidence": "The blind translation records totalized real division, while Theorem 2.8.2 states no zero-denominator convention."
    },
    {
      "item": "direct judge classification is undetermined",
      "resolution": "The classification remains undetermined for the complete stated domain, although the nondegenerate core is equivalent.",
      "primary_evidence": "When K > 0 and a is nonzero, both denominators are positive and the Lean formula exactly matches the displayed source formula; when K = 0 or a = 0, the source expression is not defined by the selected passage."
    },
    {
      "item": "round-trip judge classification is undetermined",
      "resolution": "The round-trip classification is correctly undetermined on the complete domain; its reconstructed nondegenerate proposition agrees exactly with the source.",
      "primary_evidence": "The source and translation have identical quantifiers, hypotheses, event, prefactor, norms, powers, and rate whenever K²∑a_i² and K max_i|a_i| are positive."
    },
    {
      "item": "direct judge left dependency_coverage item D050 unclear",
      "resolution": "D050 itself is understood: it is real division with inverse zero equal to zero. It agrees with ordinary division for nonzero denominators and forces each quotient to zero when its denominator is zero. The uncertainty concerns source correspondence, not the dependency's Lean meaning.",
      "primary_evidence": "The direct judgment identifies Real.instDivInvMonoid as totalized real division; the source displays quotients but gives no value for division by zero."
    },
    {
      "item": "direct judge left semantic_checklist item C06 unclear",
      "resolution": "The operators match on the exact nondegenerate core K > 0 and a ≠ 0. They do not have an established global match because Lean totalizes zero denominators and the source is silent.",
      "primary_evidence": "For K > 0 and a ≠ 0, K²∑a_i² > 0 and K max_i|a_i| > 0. For K = 0 or a = 0 both denominators vanish."
    },
    {
      "item": "direct judge left semantic_checklist item C11 unclear",
      "resolution": "The boundary issue is real and localized. The threshold t = 0 is harmless when the denominators are positive; it produces 0/0 only when K = 0 or a = 0. For t > 0 with a zero denominator, the source instead contains positive-over-zero. None of these cases receives a convention in the source.",
      "primary_evidence": "Theorem 2.8.2 includes every t ≥ 0 and arbitrary a, while Lean assigns every quotient with denominator zero the value zero and hence gives right-hand side 2."
    },
    {
      "item": "round-trip judge left semantic_checklist item C06 unclear",
      "resolution": "The translated operators are source-equivalent for positive denominators, but the translated totalization is additional boundary semantics absent from the source.",
      "primary_evidence": "The blind translation explicitly states that any zero denominator yields a defined real quotient; the PDF gives no corresponding definition."
    },
    {
      "item": "round-trip judge left semantic_checklist item C11 unclear",
      "resolution": "The translation correctly identifies the reachable boundary cases, but no source-faithfulness verdict for those cases can be forced without adding a convention.",
      "primary_evidence": "The source permits a = 0, does not exclude K = 0, and includes t = 0; its displayed fractions then have zero denominators."
    },
    {
      "item": "direct judge left implication lean_implies_source unclear",
      "resolution": "Lean implies the source on the nondegenerate core K > 0 and a ≠ 0. The full implication remains unclear because the source side has no stipulated proposition to imply on its zero-denominator domain.",
      "primary_evidence": "All non-boundary formula components and hypotheses coincide, but Lean's division-by-zero value is not stated in Theorem 2.8.2."
    },
    {
      "item": "direct judge left implication source_implies_lean unclear",
      "resolution": "The source implies Lean on the nondegenerate core. The full implication remains unclear because obtaining Lean's boundary conclusion would require assigning a meaning to the source's undefined quotients.",
      "primary_evidence": "The source statement does not exclude K = 0 or a = 0 and does not define the resulting fractions."
    },
    {
      "item": "round-trip judge left implication translation_implies_source unclear",
      "resolution": "The translation implies the source wherever both displayed denominators are positive; the whole-domain implication remains unclear at source-silent zero denominators.",
      "primary_evidence": "The translation and source have the same weighted two-sided Bernstein bound away from zero denominators, while only the translation specifies totalized division."
    },
    {
      "item": "round-trip judge left implication source_implies_translation unclear",
      "resolution": "The source implies the translation on the nondegenerate core; the full implication remains unclear because the source does not entail the translation's chosen division-by-zero semantics.",
      "primary_evidence": "Lean makes both rate branches zero and the right side 2 at zero denominators, a choice not made in the pinned source."
    }
  ],
  "implications": {
    "lean_implies_source": {
      "verdict": "unclear",
      "reasoning": "Yes on the exact nondegenerate core K > 0 and a ≠ 0, including t = 0 there. On K = 0 or a = 0, Lean assigns zero to division by zero, whereas the source supplies no boundary convention, so a whole-domain implication cannot be asserted without silently repairing the source."
    },
    "source_implies_lean": {
      "verdict": "unclear",
      "reasoning": "Yes on the exact nondegenerate core. On the explicitly reachable zero-denominator domain, the source expression has no stipulated value and therefore cannot entail Lean's totalized right-hand side without an added convention."
    }
  },
  "classification": "undetermined",
  "accepted": false,
  "remaining_uncertainties": [
    "The pinned source does not define the two quotient branches when K = 0 or a = 0. No whole-domain implication or accepted classification can be obtained without adopting an extra division or limiting convention."
  ],
  "findings": [
    {
      "severity": "major",
      "category": "source-silent-boundary-semantics",
      "evidence": "The source permits arbitrary a, every t ≥ 0, and does not require K > 0, while Lean totalizes each zero-denominator quotient to zero.",
      "impact": "The target chooses a definite boundary semantics absent from the source, preventing certification of either full implication."
    },
    {
      "severity": "note",
      "category": "nondegenerate-core",
      "evidence": "For K > 0 and a ≠ 0, both denominators are positive and the hypotheses, quantifier order, weighted event, constants, norms, powers, and inequality coincide exactly.",
      "impact": "The formalization is equivalent to the source throughout the substantive nondegenerate domain."
    },
    {
      "severity": "note",
      "category": "threshold-boundary",
      "evidence": "At t = 0 with positive denominators, both quotients are ordinary zero quotients; 0/0 occurs only when t = 0 is combined with K = 0 or a = 0.",
      "impact": "The threshold t = 0 alone is not a discrepancy; the unresolved issue is precisely zero denominators."
    }
  ],
  "rationale": "The pinned PDF hash matches the specified SHA-256. Theorem 2.8.2 and its introducing sentence establish the weighted two-sided Bernstein bound for arbitrary real coefficients and every t ≥ 0, with no positivity requirement on K or the coefficient vector. The Lean translation is exact on the nondegenerate core K > 0 and a ≠ 0. Its explicit real-division structure additionally assigns zero to quotients with zero denominators, yielding right-hand side 2 there. Because the source does not state this or any alternative convention, adjudication cannot convert the boundary silence into equivalence without silently repairing the source. Both full implications therefore remain unclear, the classification remains undetermined, and the audit is not accepted."
}
