{"schema_version":"formalization-faithfulness-1","role":"adjudicator","task_id":"HDP-01-EQ-1.7","trigger":["round-trip judge requested adjudication"],"resolved_items":[{"item":"Whether omission of the explicit Bernoulli/two-point-support premise defeats source identity and requires a source-exact wrapper","resolution":"It does not defeat faithfulness under the installed implication-based methodology and does not require a source-exact wrapper. The omission broadens the admissible summand laws while retaining every Bernoulli(p) instance, so it is genuine strengthening rather than reduced applicability. A Bernoulli-specific wrapper could improve source-facing discoverability, but it is not required for acceptance.","primary_evidence":"The source states the Bernoulli/binomial special case. The Lean theorem assumes iid L2 real summands with mean p and variance p(1-p), concludes the same normalized weak convergence to the standard normal law, and therefore applies after specialization to Bernoulli(p) summands. Both judges record the implication pair lean-implies-source=yes and source-implies-lean=no and classify the result as faithful-stronger."}],"implications":{"lean_implies_source":{"verdict":"yes","reasoning":"For 0 < p < 1, iid Bernoulli(p) summands satisfy the Lean theorem's iid, L2, mean-p, and variance-p(1-p) premises. After the harmless zero-based N+1 reparameterization, its conclusion is exactly the source's normalized convergence in distribution to N(0,1)."},"source_implies_lean":{"verdict":"no","reasoning":"The source establishes only the Bernoulli(p) case and does not establish the corresponding central limit theorem for every iid L2 real-valued law having the same first two moments."}},"classification":"faithful-stronger","accepted":true,"remaining_uncertainties":[],"findings":[{"severity":"minor","category":"domain-generalization","evidence":"The source explicitly uses Bernoulli(p), two-point-supported summands, whereas the Lean statement permits arbitrary iid L2 real summands with the same mean and variance.","impact":"This changes the source-specific presentation and may reduce discoverability as the de Moivre-Laplace special case, but it neither excludes source instances nor changes their normalization, convergence mode, or limiting law; no source-exact wrapper is required for faithfulness."},{"severity":"note","category":"index-reparameterization","evidence":"The source uses N summands indexed from 1, while Lean uses N+1 summands under zero-based indexing.","impact":"The cofinal reparameterization preserves the limiting assertion."}],"rationale":"The disputed missing Bernoulli premise is not a weakening or an unrelated change: it removes a domain restriction while preserving all source instances and the exact asymptotic conclusion. Nondegenerate Bernoulli(p) sequences witness applicability, so the strengthening is nonvacuous. The converse implication fails because the Bernoulli special case alone does not yield the general iid finite-variance result. Accordingly, the implication pair is yes/no, the methodology's consistent classification is faithful-stronger, and acceptance does not depend on adding a source-exact wrapper."}
