{
  "schema_version": "formalization-faithfulness-1",
  "role": "adjudicator",
  "task_id": "HDP-01-THM-LP-BANACH",
  "trigger": [
    "judge classifications differ",
    "round-trip judge requested adjudication",
    "round-trip judge classification is undetermined",
    "blind translator left dependency_coverage item D018 unclear",
    "round-trip judge left semantic_checklist item C04 unclear",
    "round-trip judge left semantic_checklist item C06 unclear",
    "round-trip judge left implication translation_implies_source unclear",
    "round-trip judge left implication source_implies_translation unclear"
  ],
  "resolved_items": [
    {
      "item": "judge classifications differ",
      "resolution": "Resolved as faithful-equivalent from the two independently rechecked implication directions, not by voting. The round-trip judge's two missing imported meanings are supplied by current primary Lean declarations and both implications are yes.",
      "primary_evidence": "The source on PDF pages 1-2 (printed pages 5-6) defines the finite and infinity Lp quantities and asserts normhood plus Banach completeness for every p in [1,infinity]. The current explicit target and D019-D024/D035/D051 state the same carrier, canonical norm, real scalar structure, endpoint dispatch, and completeness of the whole carrier."
    },
    {
      "item": "round-trip judge requested adjudication",
      "resolution": "The request is satisfied: D018/C04, C06, and both implications have been rechecked against primary source and current Lean definition evidence and are no longer unclear.",
      "primary_evidence": "Current Mathlib declarations define IsProbabilityMeasure by measure_univ = 1, eLpNorm' by the lintegral-and-reciprocal-power formula, eLpNormEssSup by essential supremum, eLpNorm by endpoint dispatch, and Lp.norm_def by toReal of eLpNorm; the prepared target dossier fixes the canonical Lp instances used by the statement."
    },
    {
      "item": "round-trip judge classification is undetermined",
      "resolution": "The classification is faithful-equivalent because Lean implies the source and the source implies Lean, with no reduced applicability or genuine extra conclusion.",
      "primary_evidence": "The current source contract requires exactly a real Lp norm and whole-space completeness over an arbitrary fixed probability space for all p from 1 through infinity. The target's four conjuncts decompose those requirements into canonical normed additive structure, real NormedSpace structure, exact norm identification, and IsComplete univ."
    },
    {
      "item": "blind translator left dependency_coverage item D018 unclear",
      "resolution": "D018 is understood: MeasureTheory.IsProbabilityMeasure mu is exactly the proposition that mu(Set.univ) = 1.",
      "primary_evidence": "The current declaration in Mathlib/MeasureTheory/Measure/Typeclasses/Probability.lean defines class IsProbabilityMeasure (mu : Measure alpha) with the sole field measure_univ : mu univ = 1. This resolves D018 semantic SHA-256 f88b269cb95d165125e7553fd22f97d6e5f9b1b9bcdec7f6738a781dc674bf89 and exactly matches the source's fixed probability measure P."
    },
    {
      "item": "round-trip judge left semantic_checklist item C04 unclear",
      "resolution": "C04 passes. The target has exactly the source hypotheses: a probability measure, p at least 1 including infinity, and membership in the finite-Lp carrier.",
      "primary_evidence": "D018 is mu univ = 1; the target has Fact (1 <= p) in ENNReal; and D019 defines Lp membership by eLpNorm(f.cast,p,mu) < top. The source contract states the same probability-space, exponent, and finiteness conditions."
    },
    {
      "item": "round-trip judge left semantic_checklist item C06 unclear",
      "resolution": "C06 passes. For finite p at least 1, the target's canonical norm is exactly the p-th root of the p-th absolute moment; for p = infinity it is exactly the essential supremum of the absolute value.",
      "primary_evidence": "D024 dispatches eLpNorm to eLpNorm' at finite nonzero p and to eLpNormEssSup at top. The current Defs.lean defines eLpNorm' f q mu = (lintegral a, enorm(f a)^q dmu)^(1/q) and eLpNormEssSup f mu = essSup (enorm(f)) mu. D021 and Lp.norm_def define norm(f) = toReal(eLpNorm f p mu), while D019 membership guarantees this value is finite. For real-valued f, enorm is the extended absolute value and the lintegral is the source expectation."
    },
    {
      "item": "round-trip judge left implication translation_implies_source unclear",
      "resolution": "Yes. The translated Lean proposition implies both printed claims for every p in [1,infinity].",
      "primary_evidence": "The canonical Lp.instNormedAddCommGroup supplies normhood for the D021 norm; the explicit target's real NormedSpace uses that canonical group instance; the universal equality identifies its norm with the finite moment/root or top essential-supremum formula; and D012 with D051 makes IsComplete univ completeness of the entire norm-induced uniform space."
    },
    {
      "item": "round-trip judge left implication source_implies_translation unclear",
      "resolution": "Yes. Under the standard almost-sure-equivalence interpretation forced by the source's use of the classical Lp norm, the two printed claims supply every target conjunct.",
      "primary_evidence": "The source gives real vector-space Lp, exact finite and infinity norm formulas, normhood, and Banach completeness on an arbitrary fixed probability space. Mathlib's AEEqFun quotient and finite-eLpNorm subtype are the conventional realization; normhood yields the normed additive structure, the real vector operations yield NormedSpace Real, the definitions yield Lp.norm_def, and Banach completeness is IsComplete univ."
    }
  ],
  "implications": {
    "lean_implies_source": {
      "verdict": "yes",
      "reasoning": "For any measurable Omega, probability measure mu, and ENNReal p with 1 <= p, the target uses real-valued almost-everywhere equivalence classes of finite eLpNorm. Its canonical NormedAddCommGroup and real NormedSpace encode normed real-vector structure; Lp.norm_def identifies the canonical norm pointwise with eLpNorm; finite p reduces to the source's expectation-of-absolute-pth-power raised to 1/p, top reduces to essential supremum; and IsComplete univ is completeness of the entire canonical normed space. Thus both printed claims follow at p = 1, every finite p > 1, and p = infinity."
    },
    "source_implies_lean": {
      "verdict": "yes",
      "reasoning": "Read in the source's standard classical-Lp sense, random variables are identified almost surely so that the displayed quantity is genuinely a norm. The source's real vector space, exact finite/top norm definitions, normhood, and Banach completeness then provide the canonical normed additive and real normed-space structures, the pointwise Lp.norm_def equality, and whole-space IsComplete univ for the same arbitrary fixed probability space and every p in [1,infinity]."
    }
  },
  "classification": "faithful-equivalent",
  "accepted": true,
  "remaining_uncertainties": [],
  "findings": [
    {
      "severity": "note",
      "category": "probability predicate resolved",
      "evidence": "Current Mathlib defines IsProbabilityMeasure mu with the single condition mu univ = 1.",
      "impact": "The target's measure domain exactly matches the source probability-space domain; D018 and C04 are resolved."
    },
    {
      "severity": "note",
      "category": "finite and infinity formulas resolved",
      "evidence": "Current eLpNorm definitions use the lintegral reciprocal-power formula at finite nonzero p and essential supremum at top; Lp.norm_def converts the finite result to Real.",
      "impact": "The exact source norm is represented at every p in [1,infinity], resolving C06 rather than relying on the name eLpNorm."
    },
    {
      "severity": "note",
      "category": "Banach structure decomposition",
      "evidence": "The explicit target uses Lp.instNormedAddCommGroup for the real NormedSpace and for the norm-induced uniformity in IsComplete Set.univ, alongside exact canonical norm equality.",
      "impact": "The extra conjuncts are an explicit decomposition of normhood and Banach completeness, not genuine additional strength or reduced applicability."
    },
    {
      "severity": "note",
      "category": "almost-everywhere quotient convention",
      "evidence": "The source calls the classical Lp quantity a norm without spelling out the almost-sure quotient; the target uses AEEqFun equivalence classes.",
      "impact": "The target makes explicit the standard convention necessary for the printed norm claim to be literally true and does not change its intended mathematical content."
    }
  ],
  "rationale": "The current primary definitions close both gaps that caused the round-trip judge's uncertainty. IsProbabilityMeasure is exactly total mass one. For finite p >= 1, eLpNorm is the extended-valued integral of the absolute p-th power raised to 1/p; at p = infinity it is essential supremum; Lp membership makes the value finite and Lp.norm_def converts it to the canonical real norm. The explicit target fixes the canonical Lp normed-group instance in the real NormedSpace and completeness clauses, and IsComplete univ is completeness of the whole norm-induced uniform space. Consequently the NormedAddCommGroup, real NormedSpace, exact norm formula, and completeness conjuncts are jointly equivalent to the printed assertions that the displayed Lp quantity is a norm and that Lp is Banach for every p in [1,infinity]. They are a more explicit decomposition, not genuine stronger content. The standard almost-sure quotient is made explicit by AEEqFun and resolves the source's conventional omission without narrowing its intended domain."
}
