{
  "schema_version": "formalization-faithfulness-1",
  "role": "adjudicator",
  "task_id": "HDP-02-BODY-2.1-BINOM-CENTRAL",
  "trigger": [
    "judge classifications differ",
    "round-trip judge requested adjudication",
    "round-trip judge classification is undetermined",
    "round-trip judge left semantic_checklist item C03 unclear",
    "round-trip judge left semantic_checklist item C06 unclear",
    "round-trip judge left semantic_checklist item C08 unclear",
    "round-trip judge left semantic_checklist item C11 unclear",
    "round-trip judge left implication translation_implies_source unclear",
    "round-trip judge left implication source_implies_translation unclear"
  ],
  "resolved_items": [
    {
      "item": "judge classifications differ",
      "resolution": "Resolved as faithful-equivalent. The round-trip uncertainties arose because its selected source passage did not include the inherited definition of Z_N and because it treated the source-authorized eventual meaning of ≍ as unresolved. The adjudicator's authorized inherited source context and proof-free declaration dossier resolve both issues.",
      "primary_evidence": "PDF printed page 13 defines Z_N=(S_N-N/2)/sqrt(N/4). PDF printed page 14 gives the exact central mass and its ≍1/sqrt(N) estimate, while footnote 1 explicitly permits sufficiently-large scope. The declaration dossier substitutes N=2n, defines the normalized PMF by the resulting map, and uses IsTheta atTop."
    },
    {
      "item": "round-trip judge requested adjudication",
      "resolution": "Adjudication is complete. The exact normalization, asymptotic scope, and zero-trial boundary are all resolved by primary source and declaration evidence, with no consequential uncertainty remaining.",
      "primary_evidence": "The preceding source definition of Z_N, the selected central-binomial passage, footnote 1, and the proof-free target jointly determine all disputed content."
    },
    {
      "item": "round-trip judge classification is undetermined",
      "resolution": "The final classification is faithful-equivalent. Both implication directions hold after restoring the inherited normalization and interpreting IsTheta atTop as the explicitly permitted sufficiently-large form of ≍.",
      "primary_evidence": "Under N=2n, the source and target have the same exact factor 2^(-2n) choose(2n,n), the same scale 1/sqrt(2n), and the same normalized variable (K-n)/sqrt(n/2)."
    },
    {
      "item": "round-trip judge left semantic_checklist item C03 unclear",
      "resolution": "C03 resolves to pass. The target correctly separates pointwise claims from the asymptotic claim: the exact binomial identity is universal in n, the normalized zero-mass identity is universal for positive n, and the constant-factor comparison is eventual atTop. Footnote 1 expressly authorizes the sufficiently-large interpretation of ≍, and the constants in IsTheta are uniform outside the eventual index scope.",
      "primary_evidence": "Footnote 1 says the comparison may hold 'for all x, or sometimes for all sufficiently large x.' The target uses universal quantifiers for the exact identities and Asymptotics.IsTheta Filter.atTop for the asymptotic estimate."
    },
    {
      "item": "round-trip judge left semantic_checklist item C06 unclear",
      "resolution": "C06 resolves to pass. The inherited source definition and the supplied local declaration define exactly the same normalization after N=2n: (S_{2n}-n)/sqrt(n/2). PMF.map therefore represents the law of the source's Z_{2n}, not a merely analogous standardized variable.",
      "primary_evidence": "PDF printed page 13 defines Z_N=(S_N-N/2)/sqrt(N/4). The declaration dossier defines standardizedFairBinomial n as the pushforward of Binomial(2n,1/2) by k↦(k-n)/sqrt(n/2), which is the literal substitution N=2n."
    },
    {
      "item": "round-trip judge left semantic_checklist item C08 unclear",
      "resolution": "C08 resolves to pass. The target preserves the distinction between the head count and its normalized transform: PMF.binomial is the law of S_{2n}, standardizedFairBinomial is its real-valued pushforward, and the target equates only their relevant point masses.",
      "primary_evidence": "The source distinguishes S_N from Z_N through an explicit normalization formula. The declaration dossier likewise keeps the original finite binomial PMF distinct from the pushed-forward PMF on Real and relates their masses at n and zero."
    },
    {
      "item": "round-trip judge left semantic_checklist item C11 unclear",
      "resolution": "C11 resolves to pass. The exact combinatorial identity validly includes n=0: the zero-trial binomial mass at zero and the expression (1/2)^0 choose(0,0) are both one. The normalized identity assumes n>0, exactly excluding the zero denominator in the inherited source normalization. IsTheta atTop is unaffected by the n=0 value of the totalized real expression 1/sqrt(2n).",
      "primary_evidence": "The source normalization contains sqrt(N/4), which is degenerate at N=0. The target imposes 0<n only on the normalized zero-mass equality, retains the valid exact binomial boundary identity, and places the asymptotic comparison at Filter.atTop."
    },
    {
      "item": "round-trip judge left implication translation_implies_source unclear",
      "resolution": "The corresponding final implication lean_implies_source is yes. Setting N=2n, the first conjunct gives the exact source probability, the second identifies the source Z_N zero event with the central count for positive even N, and the third supplies the source-authorized sufficiently-large constant-factor comparison with 1/sqrt(N).",
      "primary_evidence": "The target contains the exact central PMF formula, the exact normalized zero-mass equality, and IsTheta between 2^(-2n) choose(2n,n) and 1/sqrt(2n). These are the source's three claims after N=2n."
    },
    {
      "item": "round-trip judge left implication source_implies_translation unclear",
      "resolution": "The corresponding final implication source_implies_lean is yes. Every positive even N is 2n; the inherited definition of Z_N yields the target's pushforward normalization and zero-event equality; and the source's constant-factor estimate under its sufficiently-large convention yields IsTheta atTop for the nonnegative real sequences. The remaining n=0 exact identity is the valid zero-trial instance of the same binomial formula.",
      "primary_evidence": "The source gives P{S_N=N/2}=2^(-N) choose(N,N/2), its ≍1/sqrt(N) estimate, and the inherited formula for Z_N. Substitution N=2n produces every target expression exactly."
    }
  ],
  "implications": {
    "lean_implies_source": {
      "verdict": "yes",
      "reasoning": "For N=2n, the first target conjunct is exactly P{S_N=N/2}=2^(-N) choose(N,N/2). The supplied local definition is the law of the inherited source variable Z_N because (S_{2n}-n)/sqrt(n/2) is the source normalization after substitution. For n>0, its zero event is exactly the central event. The IsTheta-atTop conjunct gives the explicitly permitted sufficiently-large meaning of ≍ with comparison scale 1/sqrt(N), hence also the source's Z_N zero-mass estimate."
    },
    "source_implies_lean": {
      "verdict": "yes",
      "reasoning": "Writing each positive even N as 2n converts the source exact mass, normalization, and square-root scale verbatim into the target's three expressions. The source's sufficiently-large fixed-factor estimate is precisely mutual big-O at Filter.atTop for these nonnegative real sequences. At n=0 the normalized claim is correctly excluded, while the universally stated exact binomial identity remains valid because both sides equal one."
    }
  },
  "classification": "faithful-equivalent",
  "accepted": true,
  "remaining_uncertainties": [],
  "findings": [],
  "rationale": "Primary evidence resolves every round-trip uncertainty. The preceding source page explicitly defines Z_N=(S_N-N/2)/sqrt(N/4); substituting N=2n gives exactly the declaration's pushforward map k↦(k-n)/sqrt(n/2). Thus the normalized PMF is the law of Z_{2n}, and for n>0 its zero event is precisely the central count k=n. The exact central probability becomes (1/2)^(2n) choose(2n,n), and the comparison scale becomes 1/sqrt(2n). Footnote 1 expressly permits the eventual interpretation implemented by IsTheta atTop. The zero-trial case is handled consistently: the exact combinatorial identity is valid at n=0, the degenerate normalization is excluded by n>0, and the asymptotic relation ignores finite initial behavior. The statement is nonvacuous, both implications hold, and the correct classification is faithful-equivalent."
}
